{
  "schema_version": "1.0.0",
  "company_id": "cmp_corpflowai_synthetic",
  "tenant_id": "corpflowai-core",
  "company_type": "PRIVATE_COMPANY",
  "jurisdiction": "MU",
  "lifecycle_status": "ACTIVE",
  "record_owner": "role:company-master-operator",
  "created_at": "2026-08-06T00:00:00Z",
  "updated_at": "2026-08-06T00:00:00Z",
  "next_review_date": "2027-08-06",
  "governed_fields": [
    {
      "field_id": "fld_legal_name_v1",
      "field_key": "identity.legal_name",
      "field_value": "CorpFlowAI Synthetic Ltd",
      "information_domain": "IDENTITY",
      "canonical_source": "synthetic_registration_record",
      "source_document_reference": "ast_registration_certificate_v1",
      "source_system": "COMPANY_MASTER",
      "sensitivity_classification": "PUBLIC",
      "publication_status": "APPROVED_PUBLIC",
      "verification_status": "VERIFIED",
      "verified_by": "role:company-master-verifier",
      "verified_at": "2026-08-06T00:00:00Z",
      "approval_status": "APPROVED",
      "approved_by": "role:company-master-approver",
      "approved_at": "2026-08-06T00:00:00Z",
      "effective_from": "2026-08-06T00:00:00Z",
      "effective_to": null,
      "change_reason": "Initial synthetic Company Master proof",
      "previous_value_reference": null,
      "record_owner": "role:company-master-operator"
    },
    {
      "field_id": "fld_public_email_v1",
      "field_key": "contact.public_email",
      "field_value": "info@example.invalid",
      "information_domain": "CONTACT",
      "canonical_source": "synthetic_management_approval",
      "source_document_reference": null,
      "source_system": "COMPANY_MASTER",
      "sensitivity_classification": "PUBLIC",
      "publication_status": "APPROVED_PUBLIC",
      "verification_status": "VERIFIED",
      "verified_by": "role:company-master-verifier",
      "verified_at": "2026-08-06T00:00:00Z",
      "approval_status": "APPROVED",
      "approved_by": "role:company-master-approver",
      "approved_at": "2026-08-06T00:00:00Z",
      "effective_from": "2026-08-06T00:00:00Z",
      "effective_to": null,
      "change_reason": "Initial synthetic public contact",
      "previous_value_reference": null,
      "record_owner": "role:company-master-operator"
    }
  ],
  "assets": [
    {
      "asset_id": "ast_logo_primary_v1",
      "asset_type": "LOGO",
      "logical_alias": "brand.logo.primary",
      "title": "Synthetic CorpFlowAI primary logo v1",
      "description": "Historical approved logo version retained for traceability.",
      "storage_provider": "GOOGLE_DRIVE",
      "storage_object_id": "synthetic-drive-object-logo-v1",
      "storage_location_reference": "drive://synthetic/company/corpflowai/brand/logo-v1.svg",
      "mime_type": "image/svg+xml",
      "file_extension": "svg",
      "byte_size": 1024,
      "content_hash": "sha256:1111111111111111111111111111111111111111111111111111111111111111",
      "sensitivity_classification": "PUBLIC",
      "publication_status": "APPROVED_PUBLIC",
      "verification_status": "VERIFIED",
      "approval_status": "APPROVED",
      "lifecycle_status": "SUPERSEDED",
      "version_number": 1,
      "supersedes_asset_id": null,
      "effective_from": "2025-01-01T00:00:00Z",
      "effective_to": "2026-08-06T00:00:00Z",
      "expiry_date": null,
      "uploaded_by": "role:company-master-operator",
      "uploaded_at": "2025-01-01T00:00:00Z",
      "verified_by": "role:company-master-verifier",
      "verified_at": "2025-01-01T00:00:00Z",
      "approved_by": "role:company-master-approver",
      "approved_at": "2025-01-01T00:00:00Z",
      "retention_class": "HISTORICAL_BRAND_ASSET",
      "record_owner": "role:company-master-operator"
    },
    {
      "asset_id": "ast_logo_primary_v2",
      "asset_type": "LOGO",
      "logical_alias": "brand.logo.primary",
      "title": "Synthetic CorpFlowAI primary logo v2",
      "description": "Current approved logo resolved by future downstream renders.",
      "storage_provider": "GOOGLE_DRIVE",
      "storage_object_id": "synthetic-drive-object-logo-v2",
      "storage_location_reference": "drive://synthetic/company/corpflowai/brand/logo-v2.svg",
      "mime_type": "image/svg+xml",
      "file_extension": "svg",
      "byte_size": 1200,
      "content_hash": "sha256:2222222222222222222222222222222222222222222222222222222222222222",
      "sensitivity_classification": "PUBLIC",
      "publication_status": "APPROVED_PUBLIC",
      "verification_status": "VERIFIED",
      "approval_status": "APPROVED",
      "lifecycle_status": "ACTIVE",
      "version_number": 2,
      "supersedes_asset_id": "ast_logo_primary_v1",
      "effective_from": "2026-08-06T00:00:00Z",
      "effective_to": null,
      "expiry_date": null,
      "uploaded_by": "role:company-master-operator",
      "uploaded_at": "2026-08-05T22:00:00Z",
      "verified_by": "role:company-master-verifier",
      "verified_at": "2026-08-05T23:00:00Z",
      "approved_by": "role:company-master-approver",
      "approved_at": "2026-08-06T00:00:00Z",
      "retention_class": "CURRENT_BRAND_ASSET",
      "record_owner": "role:company-master-operator"
    },
    {
      "asset_id": "ast_logo_primary_v3",
      "asset_type": "LOGO",
      "logical_alias": "brand.logo.primary",
      "title": "Synthetic CorpFlowAI primary logo v3 (uploaded, not approved)",
      "description": "Candidate replacement logo. Must not resolve for downstream consumers until approved.",
      "storage_provider": "GOOGLE_DRIVE",
      "storage_object_id": "synthetic-drive-object-logo-v3",
      "storage_location_reference": "drive://synthetic/company/corpflowai/brand/logo-v3-candidate.svg",
      "mime_type": "image/svg+xml",
      "file_extension": "svg",
      "byte_size": 1300,
      "content_hash": "sha256:4444444444444444444444444444444444444444444444444444444444444444",
      "sensitivity_classification": "INTERNAL",
      "publication_status": "NOT_ASSESSED",
      "verification_status": "RECEIVED_NOT_VERIFIED",
      "approval_status": "NOT_REQUESTED",
      "lifecycle_status": "UPLOADED",
      "version_number": 3,
      "supersedes_asset_id": "ast_logo_primary_v2",
      "effective_from": "2026-08-06T02:00:00Z",
      "effective_to": null,
      "expiry_date": null,
      "uploaded_by": "role:company-master-operator",
      "uploaded_at": "2026-08-06T02:00:00Z",
      "verified_by": null,
      "verified_at": null,
      "approved_by": null,
      "approved_at": null,
      "retention_class": "CANDIDATE_BRAND_ASSET",
      "record_owner": "role:company-master-operator"
    },
    {
      "asset_id": "ast_registration_certificate_v1",
      "asset_type": "REGISTRATION_CERTIFICATE",
      "logical_alias": "legal.registration_certificate.current",
      "title": "Synthetic registration certificate reference",
      "description": "Restricted reference only. No certificate contents are stored in GitHub.",
      "storage_provider": "GOOGLE_DRIVE",
      "storage_object_id": "synthetic-drive-object-registration-v1",
      "storage_location_reference": "drive://synthetic-restricted/company/corpflowai/legal/registration-v1.pdf",
      "mime_type": "application/pdf",
      "file_extension": "pdf",
      "byte_size": 4096,
      "content_hash": "sha256:3333333333333333333333333333333333333333333333333333333333333333",
      "sensitivity_classification": "CONFIDENTIAL",
      "publication_status": "RESTRICTED",
      "verification_status": "VERIFIED",
      "approval_status": "APPROVED",
      "lifecycle_status": "ACTIVE",
      "version_number": 1,
      "supersedes_asset_id": null,
      "effective_from": "2026-08-06T00:00:00Z",
      "effective_to": null,
      "expiry_date": null,
      "uploaded_by": "role:company-master-operator",
      "uploaded_at": "2026-08-05T22:00:00Z",
      "verified_by": "role:company-master-verifier",
      "verified_at": "2026-08-05T23:00:00Z",
      "approved_by": "role:company-master-approver",
      "approved_at": "2026-08-06T00:00:00Z",
      "retention_class": "LEGAL_PERMANENT",
      "record_owner": "role:company-master-operator"
    }
  ],
  "evidence_requirements": [
    {
      "requirement_key": "company.registration_certificate",
      "requirement_reason": "Verify legal company identity",
      "conditional_rule": "required for incorporated companies",
      "evidence_status": "VERIFIED",
      "asset_id": "ast_registration_certificate_v1",
      "document_reference": "drive-object:synthetic-drive-object-registration-v1",
      "received_at": "2026-08-05T22:00:00Z",
      "verified_at": "2026-08-05T23:00:00Z",
      "verified_by": "role:company-master-verifier",
      "expiry_date": null,
      "waiver_reason": null,
      "waiver_approved_by": null
    }
  ]
}
